{
  "$schema": "https://json-schema.org/draft/2020-12/schema",
  "$id": "https://ai-training-platform.local/contracts/evaluation-agent-batch-v1.1.schema.json",
  "title": "Code Agent Evaluation Batch Manifest v1.1",
  "type": "object",
  "additionalProperties": false,
  "required": ["schemaVersion", "generatedAt", "batch", "agent", "contracts", "engine", "challenge", "submissions", "resultIndexPath"],
  "properties": {
    "schemaVersion": { "const": "1.1" },
    "generatedAt": { "type": "string", "format": "date-time" },
    "batch": {
      "type": "object",
      "additionalProperties": false,
      "required": ["id", "leaseId", "challengeVersion"],
      "properties": {
        "id": { "type": "string", "minLength": 1 },
        "leaseId": { "type": "string", "minLength": 1 },
        "challengeVersion": { "type": "string", "minLength": 1 }
      }
    },
    "agent": {
      "type": "object",
      "additionalProperties": false,
      "required": ["instructionPath", "skillPaths"],
      "properties": {
        "instructionPath": { "type": "string", "minLength": 1 },
        "skillPaths": { "type": "array", "minItems": 1, "items": { "type": "string", "minLength": 1 } }
      }
    },
    "contracts": {
      "type": "object",
      "additionalProperties": false,
      "required": ["input", "output"],
      "properties": {
        "input": { "$ref": "#/$defs/materializedContract" },
        "output": { "$ref": "#/$defs/materializedContract" }
      }
    },
    "engine": {
      "type": "object",
      "additionalProperties": true,
      "required": ["id", "version", "source", "packageHash", "root", "entrypoint", "assets", "params", "limits"],
      "properties": {
        "id": { "type": "string", "minLength": 1 },
        "version": { "type": "string", "minLength": 1 },
        "source": { "enum": ["BUILT_IN", "PACKAGE"] },
        "packageHash": { "type": "string", "pattern": "^[a-f0-9]{64}$" },
        "root": { "type": "string", "minLength": 1 },
        "entrypoint": { "type": "string", "minLength": 1 },
        "assets": { "type": "object" },
        "params": { "type": "object" },
        "limits": { "type": "object" }
      }
    },
    "challenge": { "type": "object" },
    "submissions": {
      "type": "array",
      "minItems": 1,
      "maxItems": 500,
      "items": {
        "type": "object",
        "additionalProperties": true,
        "required": ["runId", "idempotencyKey", "subject", "submission", "workspace", "outputPath", "scratchDir"],
        "properties": {
          "runId": { "type": "string", "minLength": 1 },
          "idempotencyKey": { "type": "string", "minLength": 1 },
          "subject": { "type": "object" },
          "submission": { "type": "object" },
          "workspace": { "type": "string", "minLength": 1 },
          "outputPath": { "type": "string", "minLength": 1 },
          "scratchDir": { "type": "string", "minLength": 1 }
        }
      }
    },
    "resultIndexPath": { "type": "string", "minLength": 1 }
  },
  "$defs": {
    "materializedContract": {
      "type": "object",
      "additionalProperties": false,
      "required": ["format", "schemaVersion", "sourcePath", "path", "sha256"],
      "properties": {
        "format": { "const": "JSON" },
        "schemaVersion": { "type": "string", "minLength": 1 },
        "sourcePath": { "type": "string", "minLength": 1 },
        "path": { "type": "string", "minLength": 1 },
        "sha256": { "type": "string", "pattern": "^[a-f0-9]{64}$" }
      }
    }
  }
}
